address,name,manufacturer,protocol,category,rssi,signal_strength,distance_estimate,tx_power,is_connectable,is_discoverable,service_count,service_names,risk_score,highest_risk,finding_count,finding_titles,first_seen,last_seen
28:CF:E9:11:22:33,MacBook Pro,Apple,Bluetooth Classic,Laptop/Computer,-72,Fair,10–30m,,True,True,2,SPP – Serial Port Profile; HID – Human Interface Device,37,HIGH,2,Device Permanently Discoverable; Serial Port Profile (SPP) Detected,2026-06-13T23:18:49.651867,2026-06-13T23:18:49.651877
F4:F1:5A:AB:CD:EF,iPhone 14 Pro,Apple,Bluetooth Low Energy,Mobile Phone,-58,Good,1–3m,,True,True,0,,15,MEDIUM,1,BLE Static Public MAC Address,2026-06-13T23:18:49.651899,2026-06-13T23:18:49.651900
00:07:AB:55:66:77,Samsung Galaxy S24,Samsung,Bluetooth Low Energy,Mobile Phone,-61,Good,3–10m,,True,True,1,Battery Service,15,MEDIUM,1,BLE Static Public MAC Address,2026-06-13T23:18:49.651911,2026-06-13T23:18:49.651912
C4:4B:D1:55:66:77,Fitbit Charge 6,Fitbit,Bluetooth Low Energy,Wearable,-81,Fair,> 30m,,True,True,2,Battery Service; Device Information,5,LOW,1,Connectable BLE — No High-Risk Services,2026-06-13T23:18:49.651920,2026-06-13T23:18:49.651920
00:15:83:AA:BB:CC,Jabra Evolve2 85,Jabra,Bluetooth Classic,Audio/Headset,-67,Good,3–10m,,True,True,2,Headset; HFP – Hands-Free,23,MEDIUM,2,Device Permanently Discoverable; Legacy Headset/DUN Profile,2026-06-13T23:18:49.651927,2026-06-13T23:18:49.651928
